0001:00:00.0 3D controller: NVIDIA Corporation TU104GL [Tesla T4] (rev a1)
        Subsystem: NVIDIA Corporation TU104GL [Tesla T4]
        Physical Slot: 4163622393
        Control: I/O- Mem+ BusMaster+ SpecCycle- MemWINV- VGASnoop- ParErr- Stepping- SERR- FastB2B- DisINTx+
        Status: Cap+ 66MHz- UDF- FastB2B- ParErr- DEVSEL=fast >TAbort- <TAbort- <MAbort- >SERR- <PERR- INTx-
        Latency: 0
        Interrupt: pin A routed to IRQ 0
        NUMA node: 0
        Region 0: Memory at 41000000 (32-bit, non-prefetchable) [size=16M]
        Region 1: Memory at fe0000000 (64-bit, prefetchable) [size=256M]
        Region 3: Memory at ff0000000 (64-bit, prefetchable) [size=32M]
        Capabilities: [60] Power Management version 3
                Flags: PMEClk- DSI- D1- D2- AuxCurrent=375mA PME(D0+,D1-,D2-,D3hot+,D3cold+)
                Status: D0 NoSoftRst- PME-Enable- DSel=0 DScale=0 PME+
        Capabilities: [68] Null
        Capabilities: [78] Express (v2) Endpoint, MSI 00
                DevCap: MaxPayload 256 bytes, PhantFunc 0, Latency L0s unlimited, L1 <64us
                        ExtTag+ AttnBtn- AttnInd- PwrInd- RBE+ FLReset- SlotPowerLimit 0.000W
                DevCtl: CorrErr+ NonFatalErr+ FatalErr+ UnsupReq-
                        RlxdOrd+ ExtTag+ PhantFunc- AuxPwr- NoSnoop+
                        MaxPayload 256 bytes, MaxReadReq 512 bytes
                DevSta: CorrErr- NonFatalErr- FatalErr- UnsupReq- AuxPwr+ TransPend-
                LnkCap: Port #16, Speed 8GT/s, Width x16, ASPM not supported
                        ClockPM+ Surprise- LLActRep- BwNot- ASPMOptComp+
                LnkCtl: ASPM Disabled; RCB 64 bytes Disabled- CommClk-
                        ExtSynch- ClockPM+ AutWidDis- BWInt- AutBWInt-
                LnkSta: Speed 2.5GT/s (downgraded), Width x16 (ok)
                        TrErr- Train- SlotClk+ DLActive- BWMgmt- ABWMgmt-
                DevCap2: Completion Timeout: Range AB, TimeoutDis+, NROPrPrP-, LTR-
                         10BitTagComp-, 10BitTagReq-, OBFF Via message, ExtFmt-, EETLPPrefix-
                         EmergencyPowerReduction Not Supported, EmergencyPowerReductionInit-
                         FRS-, TPHComp-, ExtTPHComp-
                         AtomicOpsCap: 32bit- 64bit- 128bitCAS-
                DevCtl2: Completion Timeout: 50us to 50ms, TimeoutDis-, LTR-, OBFF Disabled
                         AtomicOpsCtl: ReqEn-
                LnkCtl2: Target Link Speed: 8GT/s, EnterCompliance- SpeedDis-
                         Transmit Margin: Normal Operating Range, EnterModifiedCompliance- ComplianceSOS-
                         Compliance De-emphasis: -6dB
                LnkSta2: Current De-emphasis Level: -6dB, EqualizationComplete+, EqualizationPhase1+
                         EqualizationPhase2+, EqualizationPhase3+, LinkEqualizationRequest-
        Capabilities: [c8] MSI-X: Enable+ Count=6 Masked-
                Vector table: BAR=0 offset=00b90000
                PBA: BAR=0 offset=00ba0000
        Capabilities: [100 v1] Virtual Channel
                Caps:   LPEVC=0 RefClk=100ns PATEntryBits=1
                Arb:    Fixed- WRR32- WRR64- WRR128-
                Ctrl:   ArbSelect=Fixed
                Status: InProgress-
                VC0:    Caps:   PATOffset=00 MaxTimeSlots=1 RejSnoopTrans-
                        Arb:    Fixed- WRR32- WRR64- WRR128- TWRR128- WRR256-
                        Ctrl:   Enable+ ID=0 ArbSelect=Fixed TC/VC=01
                        Status: NegoPending- InProgress-
        Capabilities: [258 v1] L1 PM Substates
                L1SubCap: PCI-PM_L1.2- PCI-PM_L1.1- ASPM_L1.2- ASPM_L1.1- L1_PM_Substates+
                L1SubCtl1: PCI-PM_L1.2- PCI-PM_L1.1- ASPM_L1.2- ASPM_L1.1-
                L1SubCtl2:
        Capabilities: [128 v1] Power Budgeting <?>
        Capabilities: [420 v2] Advanced Error Reporting
                UESta:  DLP- SDES- TLP- FCP- CmpltTO- CmpltAbrt- UnxCmplt- RxOF- MalfTLP- ECRC- UnsupReq- ACSViol-
                UEMsk:  DLP- SDES- TLP- FCP- CmpltTO- CmpltAbrt- UnxCmplt- RxOF- MalfTLP- ECRC- UnsupReq- ACSViol-
                UESvrt: DLP+ SDES+ TLP- FCP+ CmpltTO- CmpltAbrt- UnxCmplt- RxOF+ MalfTLP+ ECRC- UnsupReq- ACSViol-
                CESta:  RxErr- BadTLP- BadDLLP- Rollover- Timeout- AdvNonFatalErr-
                CEMsk:  RxErr- BadTLP- BadDLLP- Rollover- Timeout- AdvNonFatalErr+
                AERCap: First Error Pointer: 00, ECRCGenCap- ECRCGenEn- ECRCChkCap- ECRCChkEn-
                        MultHdrRecCap- MultHdrRecEn- TLPPfxPres- HdrLogCap-
                HeaderLog: 00000000 00000000 00000000 00000000
        Capabilities: [600 v1] Vendor Specific Information: ID=0001 Rev=1 Len=024 <?>
        Capabilities: [900 v1] Secondary PCI Express
                LnkCtl3: LnkEquIntrruptEn-, PerformEqu-
                LaneErrStat: 0
        Capabilities: [bb0 v1] Resizable BAR <?>
        Capabilities: [bcc v1] Vendor Specific Information: ID=1414 Rev=1 Len=040 <?>
        Capabilities: [c14 v1] Alternative Routing-ID Interpretation (ARI)
                ARICap: MFVC- ACS-, Next Function: 1
                ARICtl: MFVC- ACS-, Function Group: 0
        Kernel driver in use: nvidia
        Kernel modules: nvidia_drm, nvidia

c93f:00:02.0 Ethernet controller: Mellanox Technologies MT27710 Family [ConnectX-4 Lx Virtual Function] (rev 80)
        Subsystem: Mellanox Technologies MT27710 Family [ConnectX-4 Lx Virtual Function]
        Physical Slot: 1
        Control: I/O- Mem+ BusMaster+ SpecCycle- MemWINV- VGASnoop- ParErr- Stepping- SERR- FastB2B- DisINTx+
        Status: Cap+ 66MHz- UDF- FastB2B- ParErr- DEVSEL=fast >TAbort- <TAbort- <MAbort- >SERR- <PERR- INTx-
        Latency: 0
        NUMA node: 0
        Region 0: Memory at ff2000000 (64-bit, prefetchable) [size=1M]
        Capabilities: [60] Express (v2) Endpoint, MSI 00
                DevCap: MaxPayload 512 bytes, PhantFunc 0, Latency L0s unlimited, L1 unlimited
                        ExtTag+ AttnBtn- AttnInd- PwrInd- RBE+ FLReset+ SlotPowerLimit 0.000W
                DevCtl: CorrErr- NonFatalErr- FatalErr- UnsupReq-
                        RlxdOrd- ExtTag- PhantFunc- AuxPwr- NoSnoop- FLReset-
                        MaxPayload 128 bytes, MaxReadReq 128 bytes
                DevSta: CorrErr- NonFatalErr- FatalErr- UnsupReq- AuxPwr- TransPend-
                LnkCap: Port #0, Speed 8GT/s, Width x8, ASPM L1, Exit Latency L1 <4us
                        ClockPM- Surprise- LLActRep- BwNot- ASPMOptComp+
                LnkCtl: ASPM Disabled; RCB 64 bytes Disabled- CommClk-
                        ExtSynch- ClockPM- AutWidDis- BWInt- AutBWInt-
                LnkSta: Speed unknown (downgraded), Width x0 (downgraded)
                        TrErr- Train- SlotClk- DLActive- BWMgmt- ABWMgmt-
                DevCap2: Completion Timeout: Range ABC, TimeoutDis+, NROPrPrP-, LTR-
                         10BitTagComp-, 10BitTagReq-, OBFF Not Supported, ExtFmt-, EETLPPrefix-
                         EmergencyPowerReduction Not Supported, EmergencyPowerReductionInit-
                         FRS-, TPHComp-, ExtTPHComp-
                         AtomicOpsCap: 32bit- 64bit- 128bitCAS-
                DevCtl2: Completion Timeout: 50us to 50ms, TimeoutDis-, LTR-, OBFF Disabled
                         AtomicOpsCtl: ReqEn-
                LnkSta2: Current De-emphasis Level: -6dB, EqualizationComplete-, EqualizationPhase1-
                         EqualizationPhase2-, EqualizationPhase3-, LinkEqualizationRequest-
        Capabilities: [9c] MSI-X: Enable+ Count=12 Masked-
                Vector table: BAR=0 offset=00002000
                PBA: BAR=0 offset=00003000
        Kernel driver in use: mlx5_core
        Kernel modules: mlx5_core