00:00.0 Host bridge: Intel Corporation Device 2020 (rev 07)
        Subsystem: Lenovo Device 1036
        Control: I/O- Mem- BusMaster- SpecCycle- MemWINV- VGASnoop- ParErr+ Stepping- SERR+ FastB2B- DisINTx+
        Status: Cap+ 66MHz- UDF- FastB2B- ParErr- DEVSEL=fast >TAbort- <TAbort- <MAbort- >SERR- <PERR- INTx-
        Interrupt: pin A routed to IRQ 0
        Capabilities: [90] Express (v2) Root Port (Slot-), MSI 00
                DevCap: MaxPayload 128 bytes, PhantFunc 0
                        ExtTag- RBE+
                DevCtl: Report errors: Correctable- Non-Fatal- Fatal- Unsupported-
                        RlxdOrd- ExtTag- PhantFunc- AuxPwr- NoSnoop-
                        MaxPayload 128 bytes, MaxReadReq 128 bytes
                DevSta: CorrErr- UncorrErr- FatalErr- UnsuppReq- AuxPwr- TransPend-
                LnkCap: Port #0, Speed 8GT/s, Width x4, ASPM not supported
                        ClockPM- Surprise+ LLActRep+ BwNot+ ASPMOptComp+
                LnkCtl: ASPM Disabled; RCB 64 bytes Disabled- CommClk-
                        ExtSynch- ClockPM- AutWidDis- BWInt- AutBWInt-
                LnkSta: Speed unknown, Width x0, TrErr- Train- SlotClk- DLActive- BWMgmt- ABWMgmt-
                RootCtl: ErrCorrectable+ ErrNon-Fatal+ ErrFatal+ PMEIntEna- CRSVisible-
                RootCap: CRSVisible-
                RootSta: PME ReqID 0000, PMEStatus- PMEPending-
                DevCap2: Completion Timeout: Range BCD, TimeoutDis+, LTR-, OBFF Not Supported ARIFwd-
                         AtomicOpsCap: Routing- 32bit+ 64bit+ 128bitCAS+
                DevCtl2: Completion Timeout: 50us to 50ms, TimeoutDis-, LTR-, OBFF Disabled ARIFwd-
                         AtomicOpsCtl: ReqEn- EgressBlck-
                LnkCtl2: Target Link Speed: 2.5GT/s, EnterCompliance- SpeedDis-
                         Transmit Margin: Normal Operating Range, EnterModifiedCompliance- ComplianceSOS-
                         Compliance De-emphasis: -6dB
                LnkSta2: Current De-emphasis Level: -6dB, EqualizationComplete-, EqualizationPhase1-
                         EqualizationPhase2-, EqualizationPhase3-, LinkEqualizationRequest-
        Capabilities: [e0] Power Management version 3
                Flags: PMEClk- DSI- D1- D2- AuxCurrent=0mA PME(D0-,D1-,D2-,D3hot-,D3cold-)
                Status: D0 NoSoftRst+ PME-Enable- DSel=0 DScale=0 PME-

00:04.0 System peripheral: Intel Corporation Sky Lake-E CBDMA Registers (rev 07)
        Subsystem: Lenovo Device 1036
pcilib: 0000:00:04.0 64-bit device address ignored.
        Control: I/O- Mem- BusMaster+ SpecCycle- MemWINV- VGASnoop- ParErr- Stepping- SERR- FastB2B- DisINTx-
        Status: Cap+ 66MHz- UDF- FastB2B- ParErr- DEVSEL=fast >TAbort- <TAbort- <MAbort- >SERR- <PERR- INTx-
        Latency: 0, Cache Line Size: 64 bytes
        Interrupt: pin A routed to IRQ 255
        Region 0: Memory at <ignored> (64-bit, non-prefetchable) [disabled]
        Capabilities: [80] MSI-X: Enable- Count=1 Masked-
                Vector table: BAR=0 offset=00002000
                PBA: BAR=0 offset=00003000
        Capabilities: [90] Express (v2) Root Complex Integrated Endpoint, MSI 00
                DevCap: MaxPayload 128 bytes, PhantFunc 0
                        ExtTag- RBE+
                DevCtl: Report errors: Correctable- Non-Fatal- Fatal- Unsupported-
                        RlxdOrd- ExtTag- PhantFunc- AuxPwr- NoSnoop-
                        MaxPayload 128 bytes, MaxReadReq 128 bytes
                DevSta: CorrErr- UncorrErr- FatalErr- UnsuppReq- AuxPwr- TransPend-
                DevCap2: Completion Timeout: Not Supported, TimeoutDis+, LTR-, OBFF Not Supported
                DevCtl2: Completion Timeout: 50us to 50ms, TimeoutDis-, LTR-, OBFF Disabled
                         AtomicOpsCtl: ReqEn-
        Capabilities: [e0] Power Management version 3
                Flags: PMEClk- DSI- D1- D2- AuxCurrent=0mA PME(D0-,D1-,D2-,D3hot-,D3cold-)
                Status: D0 NoSoftRst+ PME-Enable- DSel=0 DScale=0 PME-

00:04.1 System peripheral: Intel Corporation Sky Lake-E CBDMA Registers (rev 07)
        Subsystem: Lenovo Device 1036
pcilib: 0000:00:04.1 64-bit device address ignored.
        Control: I/O- Mem- BusMaster+ SpecCycle- MemWINV- VGASnoop- ParErr- Stepping- SERR- FastB2B- DisINTx-
        Status: Cap+ 66MHz- UDF- FastB2B- ParErr- DEVSEL=fast >TAbort- <TAbort- <MAbort- >SERR- <PERR- INTx-
        Latency: 0, Cache Line Size: 64 bytes
        Interrupt: pin B routed to IRQ 255
        Region 0: Memory at <ignored> (64-bit, non-prefetchable) [disabled]
        Capabilities: [80] MSI-X: Enable- Count=1 Masked-
                Vector table: BAR=0 offset=00002000
                PBA: BAR=0 offset=00003000
        Capabilities: [90] Express (v2) Root Complex Integrated Endpoint, MSI 00
                DevCap: MaxPayload 128 bytes, PhantFunc 0
                        ExtTag- RBE+
                DevCtl: Report errors: Correctable- Non-Fatal- Fatal- Unsupported-
                        RlxdOrd- ExtTag- PhantFunc- AuxPwr- NoSnoop-
                        MaxPayload 128 bytes, MaxReadReq 128 bytes
                DevSta: CorrErr- UncorrErr- FatalErr- UnsuppReq- AuxPwr- TransPend-
                DevCap2: Completion Timeout: Not Supported, TimeoutDis+, LTR-, OBFF Not Supported
                DevCtl2: Completion Timeout: 50us to 50ms, TimeoutDis-, LTR-, OBFF Disabled
                         AtomicOpsCtl: ReqEn-
        Capabilities: [e0] Power Management version 3
                Flags: PMEClk- DSI- D1- D2- AuxCurrent=0mA PME(D0-,D1-,D2-,D3hot-,D3cold-)
                Status: D0 NoSoftRst+ PME-Enable- DSel=0 DScale=0 PME-

00:04.2 System peripheral: Intel Corporation Sky Lake-E CBDMA Registers (rev 07)
        Subsystem: Lenovo Device 1036
pcilib: 0000:00:04.2 64-bit device address ignored.
        Control: I/O- Mem- BusMaster+ SpecCycle- MemWINV- VGASnoop- ParErr- Stepping- SERR- FastB2B- DisINTx-
        Status: Cap+ 66MHz- UDF- FastB2B- ParErr- DEVSEL=fast >TAbort- <TAbort- <MAbort- >SERR- <PERR- INTx-
        Latency: 0, Cache Line Size: 64 bytes
        Interrupt: pin C routed to IRQ 255
        Region 0: Memory at <ignored> (64-bit, non-prefetchable) [disabled]
        Capabilities: [80] MSI-X: Enable- Count=1 Masked-
                Vector table: BAR=0 offset=00002000
                PBA: BAR=0 offset=00003000
        Capabilities: [90] Express (v2) Root Complex Integrated Endpoint, MSI 00
                DevCap: MaxPayload 128 bytes, PhantFunc 0
                        ExtTag- RBE+
                DevCtl: Report errors: Correctable- Non-Fatal- Fatal- Unsupported-
                        RlxdOrd- ExtTag- PhantFunc- AuxPwr- NoSnoop-
                        MaxPayload 128 bytes, MaxReadReq 128 bytes
                DevSta: CorrErr- UncorrErr- FatalErr- UnsuppReq- AuxPwr- TransPend-
                DevCap2: Completion Timeout: Not Supported, TimeoutDis+, LTR-, OBFF Not Supported
                DevCtl2: Completion Timeout: 50us to 50ms, TimeoutDis-, LTR-, OBFF Disabled
                         AtomicOpsCtl: ReqEn-
        Capabilities: [e0] Power Management version 3
                Flags: PMEClk- DSI- D1- D2- AuxCurrent=0mA PME(D0-,D1-,D2-,D3hot-,D3cold-)
                Status: D0 NoSoftRst+ PME-Enable- DSel=0 DScale=0 PME-

00:04.3 System peripheral: Intel Corporation Sky Lake-E CBDMA Registers (rev 07)
        Subsystem: Lenovo Device 1036
pcilib: 0000:00:04.3 64-bit device address ignored.
        Control: I/O- Mem- BusMaster+ SpecCycle- MemWINV- VGASnoop- ParErr- Stepping- SERR- FastB2B- DisINTx-
        Status: Cap+ 66MHz- UDF- FastB2B- ParErr- DEVSEL=fast >TAbort- <TAbort- <MAbort- >SERR- <PERR- INTx-
        Latency: 0, Cache Line Size: 64 bytes
        Interrupt: pin D routed to IRQ 255
        Region 0: Memory at <ignored> (64-bit, non-prefetchable) [disabled]
        Capabilities: [80] MSI-X: Enable- Count=1 Masked-
                Vector table: BAR=0 offset=00002000
                PBA: BAR=0 offset=00003000
        Capabilities: [90] Express (v2) Root Complex Integrated Endpoint, MSI 00
                DevCap: MaxPayload 128 bytes, PhantFunc 0
                        ExtTag- RBE+
                DevCtl: Report errors: Correctable- Non-Fatal- Fatal- Unsupported-
                        RlxdOrd- ExtTag- PhantFunc- AuxPwr- NoSnoop-
                        MaxPayload 128 bytes, MaxReadReq 128 bytes
                DevSta: CorrErr- UncorrErr- FatalErr- UnsuppReq- AuxPwr- TransPend-
                DevCap2: Completion Timeout: Not Supported, TimeoutDis+, LTR-, OBFF Not Supported
                DevCtl2: Completion Timeout: 50us to 50ms, TimeoutDis-, LTR-, OBFF Disabled
                         AtomicOpsCtl: ReqEn-
        Capabilities: [e0] Power Management version 3
                Flags: PMEClk- DSI- D1- D2- AuxCurrent=0mA PME(D0-,D1-,D2-,D3hot-,D3cold-)
                Status: D0 NoSoftRst+ PME-Enable- DSel=0 DScale=0 PME-

00:04.4 System peripheral: Intel Corporation Sky Lake-E CBDMA Registers (rev 07)
        Subsystem: Lenovo Device 1036
pcilib: 0000:00:04.4 64-bit device address ignored.
        Control: I/O- Mem- BusMaster+ SpecCycle- MemWINV- VGASnoop- ParErr- Stepping- SERR- FastB2B- DisINTx-
        Status: Cap+ 66MHz- UDF- FastB2B- ParErr- DEVSEL=fast >TAbort- <TAbort- <MAbort- >SERR- <PERR- INTx-
        Latency: 0, Cache Line Size: 64 bytes
        Interrupt: pin A routed to IRQ 255
        Region 0: Memory at <ignored> (64-bit, non-prefetchable) [disabled]
        Capabilities: [80] MSI-X: Enable- Count=1 Masked-
                Vector table: BAR=0 offset=00002000
                PBA: BAR=0 offset=00003000
        Capabilities: [90] Express (v2) Root Complex Integrated Endpoint, MSI 00
                DevCap: MaxPayload 128 bytes, PhantFunc 0
                        ExtTag- RBE+
                DevCtl: Report errors: Correctable- Non-Fatal- Fatal- Unsupported-
                        RlxdOrd- ExtTag- PhantFunc- AuxPwr- NoSnoop-
                        MaxPayload 128 bytes, MaxReadReq 128 bytes
                DevSta: CorrErr- UncorrErr- FatalErr- UnsuppReq- AuxPwr- TransPend-
                DevCap2: Completion Timeout: Not Supported, TimeoutDis+, LTR-, OBFF Not Supported
                DevCtl2: Completion Timeout: 50us to 50ms, TimeoutDis-, LTR-, OBFF Disabled
                         AtomicOpsCtl: ReqEn-
        Capabilities: [e0] Power Management version 3
                Flags: PMEClk- DSI- D1- D2- AuxCurrent=0mA PME(D0-,D1-,D2-,D3hot-,D3cold-)
                Status: D0 NoSoftRst+ PME-Enable- DSel=0 DScale=0 PME-

00:04.5 System peripheral: Intel Corporation Sky Lake-E CBDMA Registers (rev 07)
        Subsystem: Lenovo Device 1036
pcilib: 0000:00:04.5 64-bit device address ignored.
        Control: I/O- Mem- BusMaster+ SpecCycle- MemWINV- VGASnoop- ParErr- Stepping- SERR- FastB2B- DisINTx-
        Status: Cap+ 66MHz- UDF- FastB2B- ParErr- DEVSEL=fast >TAbort- <TAbort- <MAbort- >SERR- <PERR- INTx-
        Latency: 0, Cache Line Size: 64 bytes
        Interrupt: pin B routed to IRQ 255
        Region 0: Memory at <ignored> (64-bit, non-prefetchable) [disabled]
        Capabilities: [80] MSI-X: Enable- Count=1 Masked-
                Vector table: BAR=0 offset=00002000
                PBA: BAR=0 offset=00003000
        Capabilities: [90] Express (v2) Root Complex Integrated Endpoint, MSI 00
                DevCap: MaxPayload 128 bytes, PhantFunc 0
                        ExtTag- RBE+
                DevCtl: Report errors: Correctable- Non-Fatal- Fatal- Unsupported-
                        RlxdOrd- ExtTag- PhantFunc- AuxPwr- NoSnoop-
                        MaxPayload 128 bytes, MaxReadReq 128 bytes
                DevSta: CorrErr- UncorrErr- FatalErr- UnsuppReq- AuxPwr- TransPend-
                DevCap2: Completion Timeout: Not Supported, TimeoutDis+, LTR-, OBFF Not Supported
                DevCtl2: Completion Timeout: 50us to 50ms, TimeoutDis-, LTR-, OBFF Disabled
                         AtomicOpsCtl: ReqEn-
        Capabilities: [e0] Power Management version 3
                Flags: PMEClk- DSI- D1- D2- AuxCurrent=0mA PME(D0-,D1-,D2-,D3hot-,D3cold-)
                Status: D0 NoSoftRst+ PME-Enable- DSel=0 DScale=0 PME-

00:04.6 System peripheral: Intel Corporation Sky Lake-E CBDMA Registers (rev 07)
        Subsystem: Lenovo Device 1036
pcilib: 0000:00:04.6 64-bit device address ignored.
        Control: I/O- Mem- BusMaster+ SpecCycle- MemWINV- VGASnoop- ParErr- Stepping- SERR- FastB2B- DisINTx-
        Status: Cap+ 66MHz- UDF- FastB2B- ParErr- DEVSEL=fast >TAbort- <TAbort- <MAbort- >SERR- <PERR- INTx-
        Latency: 0, Cache Line Size: 64 bytes
        Interrupt: pin C routed to IRQ 255
        Region 0: Memory at <ignored> (64-bit, non-prefetchable) [disabled]
        Capabilities: [80] MSI-X: Enable- Count=1 Masked-
                Vector table: BAR=0 offset=00002000
                PBA: BAR=0 offset=00003000
        Capabilities: [90] Express (v2) Root Complex Integrated Endpoint, MSI 00
                DevCap: MaxPayload 128 bytes, PhantFunc 0
                        ExtTag- RBE+
                DevCtl: Report errors: Correctable- Non-Fatal- Fatal- Unsupported-
                        RlxdOrd- ExtTag- PhantFunc- AuxPwr- NoSnoop-
                        MaxPayload 128 bytes, MaxReadReq 128 bytes
                DevSta: CorrErr- UncorrErr- FatalErr- UnsuppReq- AuxPwr- TransPend-
                DevCap2: Completion Timeout: Not Supported, TimeoutDis+, LTR-, OBFF Not Supported
                DevCtl2: Completion Timeout: 50us to 50ms, TimeoutDis-, LTR-, OBFF Disabled
                         AtomicOpsCtl: ReqEn-
        Capabilities: [e0] Power Management version 3
                Flags: PMEClk- DSI- D1- D2- AuxCurrent=0mA PME(D0-,D1-,D2-,D3hot-,D3cold-)
                Status: D0 NoSoftRst+ PME-Enable- DSel=0 DScale=0 PME-

00:04.7 System peripheral: Intel Corporation Sky Lake-E CBDMA Registers (rev 07)
        Subsystem: Lenovo Device 1036
pcilib: 0000:00:04.7 64-bit device address ignored.
        Control: I/O- Mem- BusMaster+ SpecCycle- MemWINV- VGASnoop- ParErr- Stepping- SERR- FastB2B- DisINTx-
        Status: Cap+ 66MHz- UDF- FastB2B- ParErr- DEVSEL=fast >TAbort- <TAbort- <MAbort- >SERR- <PERR- INTx-
        Latency: 0, Cache Line Size: 64 bytes
        Interrupt: pin D routed to IRQ 255
        Region 0: Memory at <ignored> (64-bit, non-prefetchable) [disabled]
        Capabilities: [80] MSI-X: Enable- Count=1 Masked-
                Vector table: BAR=0 offset=00002000
                PBA: BAR=0 offset=00003000
        Capabilities: [90] Express (v2) Root Complex Integrated Endpoint, MSI 00
                DevCap: MaxPayload 128 bytes, PhantFunc 0
                        ExtTag- RBE+
                DevCtl: Report errors: Correctable- Non-Fatal- Fatal- Unsupported-
                        RlxdOrd- ExtTag- PhantFunc- AuxPwr- NoSnoop-
                        MaxPayload 128 bytes, MaxReadReq 128 bytes
                DevSta: CorrErr- UncorrErr- FatalErr- UnsuppReq- AuxPwr- TransPend-
                DevCap2: Completion Timeout: Not Supported, TimeoutDis+, LTR-, OBFF Not Supported
                DevCtl2: Completion Timeout: 50us to 50ms, TimeoutDis-, LTR-, OBFF Disabled
                         AtomicOpsCtl: ReqEn-
        Capabilities: [e0] Power Management version 3
                Flags: PMEClk- DSI- D1- D2- AuxCurrent=0mA PME(D0-,D1-,D2-,D3hot-,D3cold-)
                Status: D0 NoSoftRst+ PME-Enable- DSel=0 DScale=0 PME-

00:05.0 System peripheral: Intel Corporation Sky Lake-E MM/Vt-d Configuration Registers (rev 07)
        Subsystem: Lenovo Device 1036
        Control: I/O- Mem- BusMaster- SpecCycle- MemWINV- VGASnoop- ParErr- Stepping- SERR- FastB2B- DisINTx-
        Status: Cap+ 66MHz- UDF- FastB2B- ParErr- DEVSEL=fast >TAbort- <TAbort- <MAbort- >SERR- <PERR- INTx-
        Capabilities: [40] Express (v2) Root Complex Integrated Endpoint, MSI 00
                DevCap: MaxPayload 128 bytes, PhantFunc 0
                        ExtTag- RBE-
                DevCtl: Report errors: Correctable- Non-Fatal- Fatal- Unsupported-
                        RlxdOrd- ExtTag- PhantFunc- AuxPwr- NoSnoop-
                        MaxPayload 128 bytes, MaxReadReq 128 bytes
                DevSta: CorrErr- UncorrErr- FatalErr- UnsuppReq- AuxPwr- TransPend-
                DevCap2: Completion Timeout: Not Supported, TimeoutDis-, LTR-, OBFF Not Supported
                DevCtl2: Completion Timeout: 50us to 50ms, TimeoutDis-, LTR-, OBFF Disabled
                         AtomicOpsCtl: ReqEn-

00:05.2 System peripheral: Intel Corporation Device 2025 (rev 07)
        Subsystem: Lenovo Device 1036
        Control: I/O- Mem- BusMaster- SpecCycle- MemWINV- VGASnoop- ParErr- Stepping- SERR- FastB2B- DisINTx-
        Status: Cap+ 66MHz- UDF- FastB2B- ParErr- DEVSEL=fast >TAbort- <TAbort- <MAbort- >SERR- <PERR- INTx-
        Capabilities: [40] Express (v2) Root Complex Integrated Endpoint, MSI 00
                DevCap: MaxPayload 128 bytes, PhantFunc 0
                        ExtTag- RBE-
                DevCtl: Report errors: Correctable- Non-Fatal- Fatal- Unsupported-
                        RlxdOrd- ExtTag- PhantFunc- AuxPwr- NoSnoop-
                        MaxPayload 128 bytes, MaxReadReq 128 bytes
                DevSta: CorrErr- UncorrErr- FatalErr- UnsuppReq- AuxPwr- TransPend-
                DevCap2: Completion Timeout: Not Supported, TimeoutDis-, LTR-, OBFF Not Supported
                DevCtl2: Completion Timeout: 50us to 50ms, TimeoutDis-, LTR-, OBFF Disabled
                         AtomicOpsCtl: ReqEn-

00:05.4 PIC: Intel Corporation Device 2026 (rev 07) (prog-if 20 [IO(X)-APIC])
        Subsystem: Lenovo Device 1036
        Control: I/O- Mem+ BusMaster+ SpecCycle- MemWINV- VGASnoop- ParErr- Stepping- SERR- FastB2B- DisINTx-
        Status: Cap+ 66MHz- UDF- FastB2B- ParErr- DEVSEL=fast >TAbort- <TAbort- <MAbort- >SERR- <PERR- INTx-
        Latency: 0, Cache Line Size: 64 bytes
        Region 0: Memory at a3329000 (32-bit, non-prefetchable)
        Capabilities: [44] Express (v1) Root Complex Integrated Endpoint, MSI 00
                DevCap: MaxPayload 128 bytes, PhantFunc 0
                        ExtTag- RBE-
                DevCtl: Report errors: Correctable- Non-Fatal- Fatal- Unsupported-
                        RlxdOrd- ExtTag- PhantFunc- AuxPwr- NoSnoop-
                        MaxPayload 128 bytes, MaxReadReq 128 bytes
                DevSta: CorrErr- UncorrErr- FatalErr- UnsuppReq- AuxPwr- TransPend-
        Capabilities: [e0] Power Management version 3
                Flags: PMEClk- DSI- D1- D2- AuxCurrent=0mA PME(D0-,D1-,D2-,D3hot-,D3cold-)
                Status: D0 NoSoftRst+ PME-Enable- DSel=0 DScale=0 PME-

00:08.0 System peripheral: Intel Corporation Sky Lake-E Ubox Registers (rev 07)
        Subsystem: Lenovo Device 1036
        Control: I/O- Mem- BusMaster- SpecCycle- MemWINV- VGASnoop- ParErr- Stepping- SERR- FastB2B- DisINTx-
        Status: Cap+ 66MHz- UDF- FastB2B- ParErr- DEVSEL=fast >TAbort- <TAbort- <MAbort- >SERR- <PERR- INTx-
        Capabilities: [40] Express (v2) Root Complex Integrated Endpoint, MSI 00
                DevCap: MaxPayload 128 bytes, PhantFunc 0
                        ExtTag- RBE-
                DevCtl: Report errors: Correctable- Non-Fatal- Fatal- Unsupported-
                        RlxdOrd- ExtTag- PhantFunc- AuxPwr- NoSnoop-
                        MaxPayload 128 bytes, MaxReadReq 128 bytes
                DevSta: CorrErr- UncorrErr- FatalErr- UnsuppReq- AuxPwr- TransPend-
                DevCap2: Completion Timeout: Not Supported, TimeoutDis-, LTR-, OBFF Not Supported
                DevCtl2: Completion Timeout: 50us to 50ms, TimeoutDis-, LTR-, OBFF Disabled
                         AtomicOpsCtl: ReqEn-

00:08.1 Performance counters: Intel Corporation Sky Lake-E Ubox Registers (rev 07)
        Subsystem: Lenovo Device 1036
        Control: I/O- Mem- BusMaster- SpecCycle- MemWINV- VGASnoop- ParErr- Stepping- SERR- FastB2B- DisINTx-
        Status: Cap- 66MHz- UDF- FastB2B- ParErr- DEVSEL=fast >TAbort- <TAbort- <MAbort- >SERR- <PERR- INTx-

00:08.2 System peripheral: Intel Corporation Sky Lake-E Ubox Registers (rev 07)
        Subsystem: Lenovo Device 1036
        Control: I/O- Mem- BusMaster- SpecCycle- MemWINV- VGASnoop- ParErr- Stepping- SERR- FastB2B- DisINTx-
        Status: Cap+ 66MHz- UDF- FastB2B- ParErr- DEVSEL=fast >TAbort- <TAbort- <MAbort- >SERR- <PERR- INTx-
        Capabilities: [40] Express (v2) Root Complex Integrated Endpoint, MSI 00
                DevCap: MaxPayload 128 bytes, PhantFunc 0
                        ExtTag- RBE-
                DevCtl: Report errors: Correctable- Non-Fatal- Fatal- Unsupported-
                        RlxdOrd- ExtTag- PhantFunc- AuxPwr- NoSnoop-
                        MaxPayload 128 bytes, MaxReadReq 128 bytes
                DevSta: CorrErr- UncorrErr- FatalErr- UnsuppReq- AuxPwr- TransPend-
                DevCap2: Completion Timeout: Not Supported, TimeoutDis-, LTR-, OBFF Not Supported
                DevCtl2: Completion Timeout: 50us to 50ms, TimeoutDis-, LTR-, OBFF Disabled
                         AtomicOpsCtl: ReqEn-

00:14.0 USB controller: Intel Corporation 200 Series PCH USB 3.0 xHCI Controller (prog-if 30 [XHCI])
        Subsystem: Lenovo Device 1036
pcilib: 0000:00:14.0 64-bit device address ignored.
        Control: I/O- Mem+ BusMaster+ SpecCycle- MemWINV- VGASnoop- ParErr+ Stepping- SERR+ FastB2B- DisINTx+
        Status: Cap+ 66MHz- UDF- FastB2B+ ParErr- DEVSEL=medium >TAbort- <TAbort- <MAbort- >SERR- <PERR- INTx-
        Latency: 0
        Interrupt: pin A routed to IRQ 0
        Region 0: Memory at <ignored> (64-bit, non-prefetchable)
        Capabilities: [70] Power Management version 2
                Flags: PMEClk- DSI- D1- D2- AuxCurrent=375mA PME(D0-,D1-,D2-,D3hot+,D3cold+)
                Status: D0 NoSoftRst+ PME-Enable- DSel=0 DScale=0 PME-
        Capabilities: [80] MSI: Enable+ Count=1/8 Maskable- 64bit+
                Address: 00000000fee004b0  Data: 0000

00:14.2 Signal processing controller: Intel Corporation 200 Series PCH Thermal Subsystem
        Subsystem: Lenovo Device 1036
pcilib: 0000:00:14.2 64-bit device address ignored.
        Control: I/O- Mem+ BusMaster- SpecCycle- MemWINV- VGASnoop- ParErr- Stepping- SERR- FastB2B- DisINTx-
        Status: Cap+ 66MHz- UDF- FastB2B- ParErr- DEVSEL=fast >TAbort- <TAbort- <MAbort- >SERR- <PERR- INTx-
        Interrupt: pin C routed to IRQ 255
        Region 0: Memory at <ignored> (64-bit, non-prefetchable)
        Capabilities: [50] Power Management version 3
                Flags: PMEClk- DSI+ D1- D2- AuxCurrent=0mA PME(D0-,D1-,D2-,D3hot-,D3cold-)
                Status: D0 NoSoftRst+ PME-Enable- DSel=0 DScale=0 PME-
        Capabilities: [80] MSI: Enable- Count=1/1 Maskable- 64bit-
                Address: 00000000  Data: 0000

00:16.0 Communication controller: Intel Corporation 200 Series PCH CSME HECI #1
        Subsystem: Lenovo Device 1036
pcilib: 0000:00:16.0 64-bit device address ignored.
        Control: I/O- Mem+ BusMaster+ SpecCycle- MemWINV- VGASnoop- ParErr- Stepping- SERR- FastB2B- DisINTx+
        Status: Cap+ 66MHz- UDF- FastB2B- ParErr- DEVSEL=fast >TAbort- <TAbort- <MAbort- >SERR- <PERR- INTx-
        Latency: 0
        Interrupt: pin A routed to IRQ 0
        Region 0: Memory at <ignored> (64-bit, non-prefetchable)
        Capabilities: [50] Power Management version 3
                Flags: PMEClk- DSI- D1- D2- AuxCurrent=0mA PME(D0-,D1-,D2-,D3hot+,D3cold-)
                Status: D0 NoSoftRst+ PME-Enable- DSel=0 DScale=0 PME-
        Capabilities: [8c] MSI: Enable+ Count=1/1 Maskable- 64bit+
                Address: 00000000fee00510  Data: 0000

00:16.3 Serial controller: Intel Corporation Device a2bd (prog-if 02 [16550])
        Subsystem: Lenovo Device 1036
        Control: I/O- Mem- BusMaster- SpecCycle- MemWINV- VGASnoop- ParErr- Stepping- SERR- FastB2B- DisINTx+
        Status: Cap+ 66MHz+ UDF- FastB2B+ ParErr- DEVSEL=fast >TAbort- <TAbort- <MAbort- >SERR- <PERR- INTx-
        Interrupt: pin D routed to IRQ 19
        Region 0: I/O ports at 3060 [disabled]
        Region 1: Memory at fe40f000 (32-bit, non-prefetchable) [disabled]
        Capabilities: [40] MSI: Enable- Count=1/1 Maskable- 64bit+
                Address: 0000000000000000  Data: 0000
        Capabilities: [50] Power Management version 3
                Flags: PMEClk- DSI+ D1- D2- AuxCurrent=0mA PME(D0-,D1-,D2-,D3hot-,D3cold-)
                Status: D3 NoSoftRst+ PME-Enable- DSel=0 DScale=0 PME-

00:17.0 RAID bus controller: Intel Corporation C600/X79 series chipset SATA RAID Controller
        Subsystem: Lenovo Device 1036
        Control: I/O+ Mem+ BusMaster+ SpecCycle- MemWINV- VGASnoop- ParErr+ Stepping- SERR+ FastB2B- DisINTx+
        Status: Cap+ 66MHz+ UDF- FastB2B+ ParErr- DEVSEL=medium >TAbort- <TAbort- <MAbort- >SERR- <PERR- INTx-
        Latency: 0
        Interrupt: pin A routed to IRQ 0
        Region 0: Memory at a3324000 (32-bit, non-prefetchable)
        Region 1: Memory at a3327000 (32-bit, non-prefetchable)
        Region 2: I/O ports at 3050
        Region 3: I/O ports at 3040
        Region 4: I/O ports at 3020
        Region 5: Memory at a3326000 (32-bit, non-prefetchable)
        Capabilities: [80] MSI: Enable+ Count=1/1 Maskable- 64bit-
                Address: fee000f0  Data: 0000
        Capabilities: [70] Power Management version 3
                Flags: PMEClk- DSI- D1- D2- AuxCurrent=0mA PME(D0-,D1-,D2-,D3hot+,D3cold-)
                Status: D0 NoSoftRst+ PME-Enable- DSel=0 DScale=0 PME-
        Capabilities: [a8] SATA HBA v1.0 BAR4 Offset=00000004

00:1d.0 PCI bridge: Intel Corporation 200 Series PCH PCI Express Root Port #9 (rev f0) (prog-if 00 [Normal decode])
        Control: I/O- Mem- BusMaster+ SpecCycle- MemWINV- VGASnoop- ParErr- Stepping- SERR- FastB2B- DisINTx+
        Status: Cap+ 66MHz- UDF- FastB2B- ParErr- DEVSEL=fast >TAbort- <TAbort- <MAbort- >SERR- <PERR- INTx-
        Latency: 0, Cache Line Size: 64 bytes
        Interrupt: pin A routed to IRQ 0
        Bus: primary=00, secondary=01, subordinate=01, sec-latency=0
        I/O behind bridge: 0000f000-00000fff [empty]
        Memory behind bridge: fff00000-000fffff [empty]
        Prefetchable memory behind bridge: 00000000fff00000-00000000000fffff [empty]
        Secondary status: 66MHz- FastB2B- ParErr- DEVSEL=fast >TAbort- <TAbort- <MAbort+ <SERR- <PERR-
        BridgeCtl: Parity- SERR- NoISA- VGA- MAbort- >Reset- FastB2B-
                PriDiscTmr- SecDiscTmr- DiscTmrStat- DiscTmrSERREn-
        Capabilities: [40] Express (v2) Root Port (Slot+), MSI 00
                DevCap: MaxPayload 256 bytes, PhantFunc 0
                        ExtTag- RBE+
                DevCtl: Report errors: Correctable- Non-Fatal- Fatal- Unsupported-
                        RlxdOrd- ExtTag- PhantFunc- AuxPwr- NoSnoop-
                        MaxPayload 128 bytes, MaxReadReq 128 bytes
                DevSta: CorrErr- UncorrErr- FatalErr- UnsuppReq- AuxPwr+ TransPend-
                LnkCap: Port #9, Speed 8GT/s, Width x1, ASPM L0s L1, Exit Latency L0s unlimited, L1 <4us
                        ClockPM- Surprise- LLActRep+ BwNot+ ASPMOptComp+
                LnkCtl: ASPM Disabled; RCB 64 bytes Disabled- CommClk-
                        ExtSynch- ClockPM- AutWidDis- BWInt- AutBWInt-
                LnkSta: Speed 2.5GT/s, Width x0, TrErr- Train- SlotClk+ DLActive- BWMgmt- ABWMgmt-
                SltCap: AttnBtn- PwrCtrl- MRL- AttnInd- PwrInd- HotPlug+ Surprise+
                        Slot #0, PowerLimit 0.000W; Interlock- NoCompl+
                SltCtl: Enable: AttnBtn- PwrFlt- MRL- PresDet+ CmdCplt- HPIrq+ LinkChg+
                        Control: AttnInd Unknown, PwrInd Unknown, Power- Interlock-
                SltSta: Status: AttnBtn- PowerFlt- MRL- CmdCplt- PresDet- Interlock-
                        Changed: MRL- PresDet- LinkState-
                RootCtl: ErrCorrectable- ErrNon-Fatal- ErrFatal- PMEIntEna+ CRSVisible-
                RootCap: CRSVisible-
                RootSta: PME ReqID 0000, PMEStatus- PMEPending-
                DevCap2: Completion Timeout: Range ABC, TimeoutDis+, LTR+, OBFF Via WAKE# ARIFwd+
                         AtomicOpsCap: Routing- 32bit- 64bit- 128bitCAS-
                DevCtl2: Completion Timeout: 50us to 50ms, TimeoutDis-, LTR+, OBFF Disabled ARIFwd-
                         AtomicOpsCtl: ReqEn- EgressBlck-
                LnkCtl2: Target Link Speed: 8GT/s, EnterCompliance- SpeedDis-
                         Transmit Margin: Normal Operating Range, EnterModifiedCompliance- ComplianceSOS-
                         Compliance De-emphasis: -6dB
                LnkSta2: Current De-emphasis Level: -3.5dB, EqualizationComplete-, EqualizationPhase1-
                         EqualizationPhase2-, EqualizationPhase3-, LinkEqualizationRequest-
        Capabilities: [80] MSI: Enable+ Count=1/1 Maskable- 64bit-
                Address: fee000d0  Data: 0000
        Capabilities: [90] Subsystem: Lenovo Device 1036
        Capabilities: [a0] Power Management version 3
                Flags: PMEClk- DSI- D1- D2- AuxCurrent=0mA PME(D0+,D1-,D2-,D3hot+,D3cold+)
                Status: D0 NoSoftRst- PME-Enable- DSel=0 DScale=0 PME-

00:1d.2 PCI bridge: Intel Corporation 200 Series PCH PCI Express Root Port #11 (rev f0) (prog-if 00 [Normal decode])
        Control: I/O- Mem- BusMaster+ SpecCycle- MemWINV- VGASnoop- ParErr+ Stepping- SERR+ FastB2B- DisINTx+
        Status: Cap+ 66MHz- UDF- FastB2B- ParErr- DEVSEL=fast >TAbort- <TAbort- <MAbort- >SERR- <PERR- INTx-
        Latency: 0, Cache Line Size: 64 bytes
        Interrupt: pin C routed to IRQ 0
        Bus: primary=00, secondary=02, subordinate=03, sec-latency=0
        I/O behind bridge: 0000f000-00000fff [empty]
        Memory behind bridge: fff00000-000fffff [empty]
        Prefetchable memory behind bridge: 00000000fff00000-00000000000fffff [empty]
        Secondary status: 66MHz- FastB2B- ParErr- DEVSEL=fast >TAbort- <TAbort- <MAbort+ <SERR- <PERR-
        BridgeCtl: Parity+ SERR+ NoISA- VGA- MAbort- >Reset- FastB2B-
                PriDiscTmr- SecDiscTmr- DiscTmrStat- DiscTmrSERREn-
        Capabilities: [40] Express (v2) Root Port (Slot+), MSI 00
                DevCap: MaxPayload 128 bytes, PhantFunc 0
                        ExtTag- RBE+
                DevCtl: Report errors: Correctable+ Non-Fatal+ Fatal+ Unsupported-
                        RlxdOrd- ExtTag- PhantFunc- AuxPwr- NoSnoop-
                        MaxPayload 128 bytes, MaxReadReq 128 bytes
                DevSta: CorrErr- UncorrErr- FatalErr- UnsuppReq- AuxPwr+ TransPend-
                LnkCap: Port #11, Speed 8GT/s, Width x1, ASPM not supported
                        ClockPM- Surprise- LLActRep+ BwNot+ ASPMOptComp+
                LnkCtl: ASPM Disabled; RCB 64 bytes Disabled- CommClk+
                        ExtSynch- ClockPM- AutWidDis- BWInt- AutBWInt-
                LnkSta: Speed 2.5GT/s, Width x1, TrErr- Train- SlotClk+ DLActive+ BWMgmt+ ABWMgmt-
                SltCap: AttnBtn- PwrCtrl- MRL- AttnInd- PwrInd- HotPlug- Surprise-
                        Slot #0, PowerLimit 10.000W; Interlock- NoCompl+
                SltCtl: Enable: AttnBtn- PwrFlt- MRL- PresDet- CmdCplt- HPIrq- LinkChg-
                        Control: AttnInd Unknown, PwrInd Unknown, Power- Interlock-
                SltSta: Status: AttnBtn- PowerFlt- MRL- CmdCplt- PresDet+ Interlock-
                        Changed: MRL- PresDet- LinkState+
                RootCtl: ErrCorrectable+ ErrNon-Fatal+ ErrFatal+ PMEIntEna+ CRSVisible-
                RootCap: CRSVisible-
                RootSta: PME ReqID 0000, PMEStatus- PMEPending-
                DevCap2: Completion Timeout: Range ABC, TimeoutDis+, LTR+, OBFF Not Supported ARIFwd+
                         AtomicOpsCap: Routing- 32bit- 64bit- 128bitCAS-
                DevCtl2: Completion Timeout: 50us to 50ms, TimeoutDis-, LTR+, OBFF Disabled ARIFwd-
                         AtomicOpsCtl: ReqEn- EgressBlck-
                LnkCtl2: Target Link Speed: 8GT/s, EnterCompliance- SpeedDis-
                         Transmit Margin: Normal Operating Range, EnterModifiedCompliance- ComplianceSOS-
                         Compliance De-emphasis: -6dB
                LnkSta2: Current De-emphasis Level: -3.5dB, EqualizationComplete-, EqualizationPhase1-
                         EqualizationPhase2-, EqualizationPhase3-, LinkEqualizationRequest-
        Capabilities: [80] MSI: Enable+ Count=1/1 Maskable- 64bit-
                Address: fee000b0  Data: 0000
        Capabilities: [90] Subsystem: Lenovo Device 1036
        Capabilities: [a0] Power Management version 3
                Flags: PMEClk- DSI- D1- D2- AuxCurrent=0mA PME(D0+,D1-,D2-,D3hot+,D3cold+)
                Status: D0 NoSoftRst- PME-Enable- DSel=0 DScale=0 PME-

00:1e.0 Signal processing controller: Intel Corporation 200 Series PCH Serial IO UART Controller #0
        Subsystem: Lenovo Device 1036
pcilib: 0000:00:1e.0 64-bit device address ignored.
        Control: I/O- Mem- BusMaster- SpecCycle- MemWINV- VGASnoop- ParErr- Stepping- SERR- FastB2B- DisINTx-
        Status: Cap+ 66MHz- UDF- FastB2B- ParErr- DEVSEL=fast >TAbort- <TAbort- <MAbort- >SERR- <PERR- INTx-
        Interrupt: pin A routed to IRQ 255
        Region 0: Memory at <ignored> (64-bit, non-prefetchable) [disabled]
        Capabilities: [80] Power Management version 3
                Flags: PMEClk- DSI- D1- D2- AuxCurrent=0mA PME(D0-,D1-,D2-,D3hot-,D3cold-)
                Status: D3 NoSoftRst+ PME-Enable- DSel=0 DScale=0 PME-
        Capabilities: [90] Vendor Specific Information: Len=14 <?>

00:1f.0 ISA bridge: Intel Corporation Device a2d3
        Subsystem: Lenovo Device 1036
        Control: I/O+ Mem+ BusMaster+ SpecCycle- MemWINV- VGASnoop- ParErr+ Stepping- SERR+ FastB2B- DisINTx-
        Status: Cap- 66MHz- UDF- FastB2B- ParErr- DEVSEL=medium >TAbort- <TAbort- <MAbort- >SERR- <PERR- INTx-
        Latency: 0

00:1f.2 Memory controller: Intel Corporation 200 Series PCH PMC
        Subsystem: Lenovo Device 1036
        Control: I/O- Mem- BusMaster- SpecCycle- MemWINV- VGASnoop- ParErr- Stepping- SERR- FastB2B- DisINTx-
        Status: Cap- 66MHz- UDF- FastB2B- ParErr- DEVSEL=fast >TAbort- <TAbort- <MAbort- >SERR- <PERR- INTx-
        Region 0: Memory at a3320000 (32-bit, non-prefetchable) [disabled]

00:1f.3 Audio device: Intel Corporation 200 Series PCH HD Audio
        Subsystem: Lenovo Device 1036
pcilib: 0000:00:1f.3 64-bit device address ignored.
pcilib: 0000:00:1f.3 64-bit device address ignored.
        Control: I/O- Mem+ BusMaster+ SpecCycle- MemWINV- VGASnoop- ParErr+ Stepping- SERR+ FastB2B- DisINTx-
        Status: Cap+ 66MHz- UDF- FastB2B- ParErr- DEVSEL=fast >TAbort- <TAbort- <MAbort- >SERR- <PERR- INTx-
        Latency: 32, Cache Line Size: 64 bytes
        Interrupt: pin A routed to IRQ 16
        Region 0: Memory at <ignored> (64-bit, non-prefetchable)
        Region 4: Memory at <ignored> (64-bit, non-prefetchable)
        Capabilities: [50] Power Management version 3
                Flags: PMEClk- DSI- D1- D2- AuxCurrent=55mA PME(D0-,D1-,D2-,D3hot+,D3cold+)
                Status: D0 NoSoftRst+ PME-Enable- DSel=0 DScale=0 PME-
        Capabilities: [60] MSI: Enable- Count=1/1 Maskable- 64bit+
                Address: 0000000000000000  Data: 0000

00:1f.4 SMBus: Intel Corporation 200 Series PCH SMBus Controller
        Subsystem: Lenovo Device 1036
pcilib: 0000:00:1f.4 64-bit device address ignored.
        Control: I/O+ Mem+ BusMaster- SpecCycle- MemWINV- VGASnoop- ParErr- Stepping- SERR- FastB2B- DisINTx-
        Status: Cap- 66MHz- UDF- FastB2B+ ParErr- DEVSEL=medium >TAbort- <TAbort- <MAbort- >SERR- <PERR- INTx-
        Interrupt: pin A routed to IRQ 255
        Region 0: Memory at <ignored> (64-bit, non-prefetchable)
        Region 4: I/O ports at 3000

00:1f.6 Ethernet controller: Intel Corporation Ethernet Connection (2) I219-LM
        Subsystem: Lenovo Device 1036
        Control: I/O- Mem+ BusMaster+ SpecCycle- MemWINV- VGASnoop- ParErr+ Stepping- SERR+ FastB2B- DisINTx+
        Status: Cap+ 66MHz- UDF- FastB2B- ParErr- DEVSEL=fast >TAbort- <TAbort- <MAbort- >SERR- <PERR- INTx-
        Latency: 0
        Interrupt: pin D routed to IRQ 0
        Region 0: Memory at a3300000 (32-bit, non-prefetchable)
        Capabilities: [c8] Power Management version 3
                Flags: PMEClk- DSI+ D1- D2- AuxCurrent=0mA PME(D0+,D1-,D2-,D3hot+,D3cold+)
                Status: D0 NoSoftRst+ PME-Enable+ DSel=0 DScale=1 PME-
        Capabilities: [d0] MSI: Enable+ Count=1/1 Maskable- 64bit+
                Address: 00000000fee00470  Data: 0000
        Capabilities: [e0] PCI Advanced Features
                AFCap: TP+ FLR+
                AFCtrl: FLR-
                AFStatus: TP-

02:00.0 PCI bridge: Pericom Semiconductor Device e113 (prog-if 00 [Normal decode])
        Control: I/O- Mem- BusMaster+ SpecCycle- MemWINV- VGASnoop- ParErr+ Stepping- SERR+ FastB2B- DisINTx+
        Status: Cap+ 66MHz- UDF- FastB2B- ParErr- DEVSEL=fast >TAbort- <TAbort- <MAbort- >SERR- <PERR- INTx-
        Latency: 0, Cache Line Size: 64 bytes
        Interrupt: pin A routed to IRQ 255
        Bus: primary=02, secondary=03, subordinate=03, sec-latency=64
        I/O behind bridge: 0000f000-00000fff [empty]
        Memory behind bridge: fff00000-000fffff [empty]
        Prefetchable memory behind bridge: 00000000fff00000-00000000000fffff [empty]
        Secondary status: 66MHz+ FastB2B+ ParErr- DEVSEL=medium >TAbort- <TAbort- <MAbort+ <SERR- <PERR-
        BridgeCtl: Parity+ SERR+ NoISA- VGA- MAbort- >Reset- FastB2B-
                PriDiscTmr- SecDiscTmr- DiscTmrStat- DiscTmrSERREn-
        Capabilities: [80] PCI-X bridge device
                Secondary Status: 64bit- 133MHz- SCD- USC- SCO- SRD- Freq=conv
                Status: Dev=02:00.0 64bit- 133MHz- SCD- USC- SCO- SRD-
                Upstream: Capacity=16 CommitmentLimit=16
                Downstream: Capacity=16 CommitmentLimit=16
        Capabilities: [90] Power Management version 3
                Flags: PMEClk- DSI- D1- D2- AuxCurrent=55mA PME(D0+,D1-,D2-,D3hot+,D3cold+)
                Status: D0 NoSoftRst+ PME-Enable- DSel=0 DScale=0 PME-
        Capabilities: [a8] Subsystem: Device 0000:0000
        Capabilities: [b0] Express (v1) PCI-Express to PCI/PCI-X Bridge, MSI 00
                DevCap: MaxPayload 512 bytes, PhantFunc 0
                        ExtTag+ AttnBtn- AttnInd- PwrInd- RBE+ SlotPowerLimit 0.000W
                DevCtl: Report errors: Correctable+ Non-Fatal+ Fatal+ Unsupported-
                        RlxdOrd- ExtTag+ PhantFunc- AuxPwr- NoSnoop- BrConfRtry-
                        MaxPayload 128 bytes, MaxReadReq 512 bytes
                DevSta: CorrErr+ UncorrErr+ FatalErr- UnsuppReq+ AuxPwr+ TransPend-
                LnkCap: Port #0, Speed 2.5GT/s, Width x1, ASPM L0s L1, Exit Latency L0s <512ns, L1 <1us
                        ClockPM- Surprise- LLActRep- BwNot- ASPMOptComp-
                LnkCtl: ASPM Disabled; RCB 64 bytes Disabled- CommClk+
                        ExtSynch- ClockPM- AutWidDis- BWInt- AutBWInt-
                LnkSta: Speed 2.5GT/s, Width x1, TrErr- Train- SlotClk+ DLActive+ BWMgmt- ABWMgmt-
        Capabilities: [f0] MSI: Enable- Count=1/1 Maskable- 64bit+
                Address: 0000000000000000  Data: 0000